{
  "$schema": "https://json-schema.org/draft/2020-12/schema",
  "$id": "urn:gala:schema:problem:2.0.0",
  "title": "Gala problem contract",
  "type": "object",
  "required": [
    "schemaId",
    "schemaVersion",
    "type",
    "title",
    "status",
    "code",
    "detail",
    "correlationId",
    "retryable",
    "errors"
  ],
  "properties": {
    "schemaId": { "const": "urn:gala:schema:problem:2.0.0" },
    "schemaVersion": { "const": "2.0.0" },
    "type": { "$ref": "#/$defs/problemType" },
    "title": {
      "$ref": "#/$defs/plainText",
      "x-gala-graphemeLength": { "minimum": 1, "maximum": 120 }
    },
    "status": { "type": "integer", "minimum": 400, "maximum": 599 },
    "code": { "$ref": "#/$defs/problemCode" },
    "detail": {
      "$ref": "#/$defs/plainText",
      "x-gala-graphemeLength": { "minimum": 0, "maximum": 500 }
    },
    "instance": { "$ref": "#/$defs/canonicalRoute" },
    "correlationId": { "$ref": "#/$defs/stableId" },
    "operationId": { "$ref": "#/$defs/stableId" },
    "retryable": { "type": "boolean" },
    "errors": {
      "type": "array",
      "items": { "$ref": "#/$defs/fieldError" },
      "minItems": 0,
      "maxItems": 100
    },
    "expectedBase": {
      "allOf": [{ "$ref": "#/$defs/urlHttps" }],
      "maxLength": 2048,
      "description": "SCHEMA-3.17.0, optional, carried by a CANONICAL_BASE_MISMATCH problem and absent from every other: the address the site is served from right now and so the canonical base its publication profile must carry (the active custom domain once the domain redirects the project path, otherwise the github.io address)."
    },
    "profileBase": {
      "type": "string",
      "maxLength": 2048,
      "description": "SCHEMA-3.17.0, optional, carried by a CANONICAL_BASE_MISMATCH problem and absent from every other: the canonical base the publication profile (`gala/publication.json`) carries now, as written. A string rather than an https URL because the mismatch can be a value that is not one (for example an http address)."
    },
    "domainState": {
      "type": "string",
      "minLength": 1,
      "maxLength": 80,
      "description": "SCHEMA-3.17.0, optional, carried by a CANONICAL_BASE_MISMATCH problem and absent from every other: the state of the site's custom-domain binding that decided `expectedBase` (a `DomainBindingState` value such as `CERTIFICATE_PENDING` or `ACTIVE`), absent when the site has no custom domain. A client shows a value it does not know as is."
    },
    "remedy": {
      "$ref": "#/$defs/plainText",
      "description": "SCHEMA-3.17.0, optional, carried by a CANONICAL_BASE_MISMATCH problem and absent from every other: one sentence, written for the author, saying what resolves the mismatch. A client may render it verbatim.",
      "x-gala-graphemeLength": { "minimum": 1, "maximum": 500 }
    }
  },
  "additionalProperties": false,
  "$defs": {
    "stableId": {
      "type": "string",
      "pattern": "^[0-9a-f]{8}-[0-9a-f]{4}-7[0-9a-f]{3}-[89ab][0-9a-f]{3}-[0-9a-f]{12}$",
      "description": "Lowercase canonical UUIDv7. Once published, it is immutable; its time ordering conveys neither chronology nor authority."
    },
    "slug": {
      "type": "string",
      "minLength": 1,
      "maxLength": 80,
      "pattern": "^[a-z0-9]+(?:-[a-z0-9]+)*$"
    },
    "repoRelativePath": {
      "type": "string",
      "minLength": 1,
      "maxLength": 512,
      "pattern": "^(?!/)(?!.*\\\\)(?!.*\\u0000).+$",
      "format": "gala-repository-relative-path",
      "x-gala-utf8ByteLength": { "maximum": 512 },
      "description": "NFC UTF-8 repository-relative path using slash separators, with no leading slash, dot segment, NUL, backslash, or percent-decoded traversal."
    },
    "canonicalRoute": {
      "type": "string",
      "minLength": 1,
      "pattern": "^/(?!/)(?!.*//)(?!.*[?#]).*$",
      "format": "gala-canonical-route",
      "description": "Absolute normalized route with no query, fragment, dot segment, double slash, or non-normalized percent encoding."
    },
    "gitObjectId": {
      "type": "string",
      "pattern": "^(?:sha1:[0-9a-f]{40}|sha256:[0-9a-f]{64})$"
    },
    "digest": { "type": "string", "pattern": "^sha256:[0-9a-f]{64}$" },
    "urlHttps": {
      "type": "string",
      "format": "uri",
      "pattern": "^https://(?![^/?#]*@)",
      "description": "Absolute HTTPS URL without embedded credentials."
    },
    "bcp47": {
      "type": "string",
      "minLength": 1,
      "maxLength": 255,
      "pattern": "^[A-Za-z0-9-]+$",
      "format": "gala-bcp47",
      "x-gala-utf8ByteLength": { "minimum": 1, "maximum": 255 },
      "description": "Structurally valid canonical BCP-47 language tag."
    },
    "isoCountry": {
      "type": "string",
      "pattern": "^[A-Z]{2}$",
      "format": "gala-iso-country",
      "description": "ISO 3166-1 alpha-2 country code; admission remains subject to the active policy profile."
    },
    "plainLabel": {
      "type": "string",
      "format": "gala-plain-label",
      "x-gala-graphemeLength": { "minimum": 1, "maximum": 80 },
      "description": "Normalized Unicode plain text without markup, controls, or bidi overrides."
    },
    "plainText": {
      "type": "string",
      "format": "gala-plain-text",
      "description": "NFC Unicode text without disallowed C0/C1 controls or bidi override/isolate controls."
    },
    "rfc3339": {
      "type": "string",
      "format": "date-time",
      "pattern": "^[0-9]{4}-(?:0[1-9]|1[0-2])-(?:0[1-9]|[12][0-9]|3[01])T(?:[01][0-9]|2[0-3]):[0-5][0-9]:[0-5][0-9]\\.[0-9]{3}Z$",
      "description": "Canonical Gala UTC millisecond subset of RFC 3339."
    },
    "semver": {
      "type": "string",
      "pattern": "^(?:0|[1-9]\\d*)\\.(?:0|[1-9]\\d*)\\.(?:0|[1-9]\\d*)(?:-(?:0|[1-9]\\d*|\\d*[A-Za-z-][0-9A-Za-z-]*)(?:\\.(?:0|[1-9]\\d*|\\d*[A-Za-z-][0-9A-Za-z-]*))*)?$",
      "description": "Canonical SemVer 2.0.0 without build metadata."
    },
    "semverRange": {
      "type": "string",
      "minLength": 1,
      "pattern": "^(?:\\S+|\\S+ \\S+)$",
      "format": "gala-semver-range",
      "description": "Whitespace-free npm-compatible exact, caret, or bounded comparator-set range; tags and URLs are invalid."
    },
    "packageRange": {
      "type": "string",
      "minLength": 3,
      "pattern": "^(?:@[a-z0-9](?:[a-z0-9._-]*[a-z0-9])?/[a-z0-9](?:[a-z0-9._-]*[a-z0-9])?|[a-z0-9](?:[a-z0-9._-]*[a-z0-9])?)@(?:\\S+|\\S+ \\S+)$",
      "format": "gala-package-range",
      "description": "Lowercase npm package identity and admitted semver range; Git, file, URL, and alias sources are invalid."
    },
    "packageExact": {
      "type": "string",
      "minLength": 3,
      "pattern": "^(?:@[a-z0-9](?:[a-z0-9._-]*[a-z0-9])?/[a-z0-9](?:[a-z0-9._-]*[a-z0-9])?|[a-z0-9](?:[a-z0-9._-]*[a-z0-9])?)@\\S+$",
      "format": "gala-package-exact",
      "description": "Lowercase npm package identity and exact canonical semantic version; aliases are invalid."
    },
    "urn": {
      "type": "string",
      "minLength": 10,
      "maxLength": 255,
      "format": "uri",
      "pattern": "^urn:gala:[\\x21-\\x7E]+$",
      "description": "Absolute ASCII URN in the schema-declared Gala namespace."
    },
    "glob": {
      "type": "string",
      "minLength": 1,
      "maxLength": 256,
      "format": "gala-repository-glob",
      "x-gala-utf8ByteLength": { "maximum": 256 },
      "description": "Repository-relative POSIX glob using only star, globstar, and question-mark operators; braces, extglobs, negation, absolute paths, and parent traversal are invalid."
    },
    "passiveVisualToken": false,
    "extensionKey": {
      "type": "string",
      "format": "gala-extension-key",
      "description": "Reverse-DNS extension namespace that cannot shadow a core key."
    },
    "problemType": {
      "oneOf": [
        { "$ref": "#/$defs/problemHttpsType" },
        { "$ref": "#/$defs/problemUrn" }
      ]
    },
    "problemHttpsType": {
      "allOf": [{ "$ref": "#/$defs/urlHttps" }],
      "type": "string",
      "pattern": "^https://[^#]+$"
    },
    "problemUrn": {
      "type": "string",
      "format": "uri",
      "pattern": "^urn:gala:problem:[a-z0-9]+(?:-[a-z0-9]+)*$"
    },
    "problemCode": {
      "allOf": [{ "$ref": "#/$defs/plainLabel" }],
      "type": "string",
      "pattern": "^[A-Z][A-Z0-9]*(?:_[A-Z0-9]+)*$"
    },
    "fieldError": {
      "type": "object",
      "required": ["pointer", "code"],
      "properties": {
        "pointer": { "type": "string", "minLength": 1, "maxLength": 1024 },
        "code": { "$ref": "#/$defs/problemCode" },
        "reason": {
          "type": "string",
          "enum": [
            "AUTHOR_EDITED",
            "BRANCH_PROTECTION",
            "REPOSITORY_ARCHIVED",
            "INSTALLATION_SUSPENDED",
            "WORKFLOWS_PERMISSION_MISSING",
            "AUTHORIZATION_LOST",
            "FORBIDDEN"
          ],
          "description": "SCHEMA-3.9.0, optional: why a REPOSITORY_NEEDS_UPDATE error needs the author. AUTHOR_EDITED: a managed file was changed in a way only the author may resolve. BRANCH_PROTECTION: GitHub refused Galascribe's own commit. REPOSITORY_ARCHIVED: the repository is archived. INSTALLATION_SUSPENDED: the GitHub App installation is suspended. WORKFLOWS_PERMISSION_MISSING: the installation has not accepted the workflows permission. AUTHORIZATION_LOST: Galascribe lost its GitHub authorization. FORBIDDEN: GitHub refused for another permission reason. Absent from older servers and for other codes; a client shows a generic sentence for a value it does not know."
        },
        "paths": {
          "type": "array",
          "items": { "type": "string", "minLength": 1, "maxLength": 512 },
          "minItems": 0,
          "maxItems": 50,
          "description": "SCHEMA-3.9.0, optional: the managed repository file paths the error is about, as the App lists them. Absent from older servers."
        }
      },
      "additionalProperties": false
    }
  }
}
