{
  "schemaId": "urn:gala:schema:problem:2.0.0",
  "schemaVersion": "2.0.0",
  "type": "urn:gala:problem:not-found",
  "title": "fixture-1",
  "status": 400,
  "code": "FIXTURE",
  "detail": "fixture-1",
  "correlationId": "019c0000-0000-7000-8000-000000000001",
  "retryable": false,
  "errors": [{ "pointer": "fixture-1", "code": "FIXTURE" }]
}
